{
  "schemaVersion": 2,
  "datasetRevision": "calculation-benchmark-4",
  "provenance": {
    "calculationPackage": "PathFinder.CalculationKernel",
    "calculationRevision": "4",
    "calculationSourceManifestSha256": "8b18ca9d53040ea613fb082d7b43a3d20635f826ba3bee4d779185b04a319102",
    "referenceManifestSha256": "6ce9f11083f023976942e5c6e6bddf303c1cf4958362242340eea33836ff99e4",
    "astronomyEngineVersion": "2.1.19",
    "nodaTimeVersion": "3.3.3",
    "tzdbVersion": "TZDB: 2026c (mapping: 48.2)",
    "jplApiSource": "NASA/JPL Horizons API",
    "jplApiVersion": "1.2",
    "swissEphemerisVersion": "2.10.03",
    "swissSourceCommit": "175e1fcb3108bcd5c0d146c803f51dcf23508012",
    "swissExecutableSha256": "8cb956985f8619174377a8aaa17245e5035838f867a1ec3ac284adf4821a8cf0",
    "horizonsUtSemantics": "Horizons TIME_TYPE=UT means UT1 before 1962 and UTC from 1962 onward.",
    "horizons1950InputSemantics": "The 1950 proleptic-UTC calendar input is interpreted by Horizons as UT1; no EOP correction is applied.",
    "swissUtSemantics": "Swiss swetest -ut receives the recorded UT calendar/Julian date for house sidereal-time calculation; no DUT1 correction is applied.",
    "dut1AssumptionSeconds": 0
  },
  "summary": {
    "positionRows": 44,
    "positionPassed": 44,
    "medianNominalUtcPositionErrorArcsec": 1.861,
    "maximumNominalUtcPositionErrorArcsec": 74.756,
    "medianMatchedTtPositionErrorArcsec": 1.517,
    "maximumMatchedTtPositionErrorArcsec": 74.755,
    "houseCuspRows": 48,
    "houseCuspsPassed": 48,
    "maximumHouseCuspErrorArcsec": 11.797,
    "timingRows": 6,
    "timingsPassed": 6,
    "maximumTimingErrorMinutes": 15.258,
    "historicalTimeRows": 3,
    "historicalTimesExecuted": 3
  },
  "positions": [
    {
      "caseId": "sun-1950-01-01t00-00-00z",
      "body": "Sun",
      "utc": "1950-01-01T00:00:00Z",
      "pathfinderLongitudeDeg": 280.0046873,
      "jplNominalUtcLongitudeDeg": 280.0048301,
      "jplMatchedTtLongitudeDeg": 280.0048315,
      "nominalUtcErrorArcsec": 0.514,
      "matchedTtErrorArcsec": 0.519,
      "pathfinderDeltaTSeconds": 29.054,
      "horizonsNominalTimeType": "UT",
      "horizonsNominalTimeValue": "1950-Jan-01 00:00:00.000",
      "horizonsMatchedTimeType": "TT",
      "horizonsMatchedTimeValue": "1950-Jan-01 00:00:29.053",
      "toleranceArcsec": 60,
      "passed": true
    },
    {
      "caseId": "sun-2000-01-01t12-00-00z",
      "body": "Sun",
      "utc": "2000-01-01T12:00:00Z",
      "pathfinderLongitudeDeg": 280.3687386,
      "jplNominalUtcLongitudeDeg": 280.3689092,
      "jplMatchedTtLongitudeDeg": 280.3689052,
      "nominalUtcErrorArcsec": 0.614,
      "matchedTtErrorArcsec": 0.6,
      "pathfinderDeltaTSeconds": 63.847,
      "horizonsNominalTimeType": "UT",
      "horizonsNominalTimeValue": "2000-Jan-01 12:00:00.000",
      "horizonsMatchedTimeType": "TT",
      "horizonsMatchedTimeValue": "2000-Jan-01 12:01:03.847",
      "toleranceArcsec": 60,
      "passed": true
    },
    {
      "caseId": "sun-2024-01-01t12-00-00z",
      "body": "Sun",
      "utc": "2024-01-01T12:00:00Z",
      "pathfinderLongitudeDeg": 280.5485271,
      "jplNominalUtcLongitudeDeg": 280.548482,
      "jplMatchedTtLongitudeDeg": 280.548537,
      "nominalUtcErrorArcsec": 0.162,
      "matchedTtErrorArcsec": 0.036,
      "pathfinderDeltaTSeconds": 73.849,
      "horizonsNominalTimeType": "UT",
      "horizonsNominalTimeValue": "2024-Jan-01 12:00:00.000",
      "horizonsMatchedTimeType": "TT",
      "horizonsMatchedTimeValue": "2024-Jan-01 12:01:13.849",
      "toleranceArcsec": 60,
      "passed": true
    },
    {
      "caseId": "sun-2050-01-01t00-00-00z",
      "body": "Sun",
      "utc": "2050-01-01T00:00:00Z",
      "pathfinderLongitudeDeg": 280.748509,
      "jplNominalUtcLongitudeDeg": 280.7483818,
      "jplMatchedTtLongitudeDeg": 280.7486623,
      "nominalUtcErrorArcsec": 0.458,
      "matchedTtErrorArcsec": 0.552,
      "pathfinderDeltaTSeconds": 92.968,
      "horizonsNominalTimeType": "UT",
      "horizonsNominalTimeValue": "2050-Jan-01 00:00:00.000",
      "horizonsMatchedTimeType": "TT",
      "horizonsMatchedTimeValue": "2050-Jan-01 00:01:32.968",
      "toleranceArcsec": 60,
      "passed": true
    },
    {
      "caseId": "moon-1950-01-01t00-00-00z",
      "body": "Moon",
      "utc": "1950-01-01T00:00:00Z",
      "pathfinderLongitudeDeg": 61.415389,
      "jplNominalUtcLongitudeDeg": 61.4154091,
      "jplMatchedTtLongitudeDeg": 61.4154261,
      "nominalUtcErrorArcsec": 0.072,
      "matchedTtErrorArcsec": 0.133,
      "pathfinderDeltaTSeconds": 29.054,
      "horizonsNominalTimeType": "UT",
      "horizonsNominalTimeValue": "1950-Jan-01 00:00:00.000",
      "horizonsMatchedTimeType": "TT",
      "horizonsMatchedTimeValue": "1950-Jan-01 00:00:29.053",
      "toleranceArcsec": 60,
      "passed": true
    },
    {
      "caseId": "moon-2000-01-01t12-00-00z",
      "body": "Moon",
      "utc": "2000-01-01T12:00:00Z",
      "pathfinderLongitudeDeg": 223.3238911,
      "jplNominalUtcLongitudeDeg": 223.323786,
      "jplMatchedTtLongitudeDeg": 223.3237392,
      "nominalUtcErrorArcsec": 0.378,
      "matchedTtErrorArcsec": 0.547,
      "pathfinderDeltaTSeconds": 63.847,
      "horizonsNominalTimeType": "UT",
      "horizonsNominalTimeValue": "2000-Jan-01 12:00:00.000",
      "horizonsMatchedTimeType": "TT",
      "horizonsMatchedTimeValue": "2000-Jan-01 12:01:03.847",
      "toleranceArcsec": 60,
      "passed": true
    },
    {
      "caseId": "moon-2024-01-01t12-00-00z",
      "body": "Moon",
      "utc": "2024-01-01T12:00:00Z",
      "pathfinderLongitudeDeg": 161.9077369,
      "jplNominalUtcLongitudeDeg": 161.9070323,
      "jplMatchedTtLongitudeDeg": 161.9076702,
      "nominalUtcErrorArcsec": 2.537,
      "matchedTtErrorArcsec": 0.24,
      "pathfinderDeltaTSeconds": 73.849,
      "horizonsNominalTimeType": "UT",
      "horizonsNominalTimeValue": "2024-Jan-01 12:00:00.000",
      "horizonsMatchedTimeType": "TT",
      "horizonsMatchedTimeValue": "2024-Jan-01 12:01:13.849",
      "toleranceArcsec": 60,
      "passed": true
    },
    {
      "caseId": "moon-2050-01-01t00-00-00z",
      "body": "Moon",
      "utc": "2050-01-01T00:00:00Z",
      "pathfinderLongitudeDeg": 18.6791435,
      "jplNominalUtcLongitudeDeg": 18.6755965,
      "jplMatchedTtLongitudeDeg": 18.6793111,
      "nominalUtcErrorArcsec": 12.769,
      "matchedTtErrorArcsec": 0.603,
      "pathfinderDeltaTSeconds": 92.968,
      "horizonsNominalTimeType": "UT",
      "horizonsNominalTimeValue": "2050-Jan-01 00:00:00.000",
      "horizonsMatchedTimeType": "TT",
      "horizonsMatchedTimeValue": "2050-Jan-01 00:01:32.968",
      "toleranceArcsec": 60,
      "passed": true
    },
    {
      "caseId": "mercury-1950-01-01t00-00-00z",
      "body": "Mercury",
      "utc": "1950-01-01T00:00:00Z",
      "pathfinderLongitudeDeg": 299.4469721,
      "jplNominalUtcLongitudeDeg": 299.4472523,
      "jplMatchedTtLongitudeDeg": 299.4472538,
      "nominalUtcErrorArcsec": 1.009,
      "matchedTtErrorArcsec": 1.014,
      "pathfinderDeltaTSeconds": 29.054,
      "horizonsNominalTimeType": "UT",
      "horizonsNominalTimeValue": "1950-Jan-01 00:00:00.000",
      "horizonsMatchedTimeType": "TT",
      "horizonsMatchedTimeValue": "1950-Jan-01 00:00:29.053",
      "toleranceArcsec": 60,
      "passed": true
    },
    {
      "caseId": "mercury-2000-01-01t12-00-00z",
      "body": "Mercury",
      "utc": "2000-01-01T12:00:00Z",
      "pathfinderLongitudeDeg": 271.8889121,
      "jplNominalUtcLongitudeDeg": 271.8892699,
      "jplMatchedTtLongitudeDeg": 271.8892638,
      "nominalUtcErrorArcsec": 1.288,
      "matchedTtErrorArcsec": 1.266,
      "pathfinderDeltaTSeconds": 63.847,
      "horizonsNominalTimeType": "UT",
      "horizonsNominalTimeValue": "2000-Jan-01 12:00:00.000",
      "horizonsMatchedTimeType": "TT",
      "horizonsMatchedTimeValue": "2000-Jan-01 12:01:03.847",
      "toleranceArcsec": 60,
      "passed": true
    },
    {
      "caseId": "mercury-2024-01-01t12-00-00z",
      "body": "Mercury",
      "utc": "2024-01-01T12:00:00Z",
      "pathfinderLongitudeDeg": 262.2107926,
      "jplNominalUtcLongitudeDeg": 262.2120128,
      "jplMatchedTtLongitudeDeg": 262.2120074,
      "nominalUtcErrorArcsec": 4.393,
      "matchedTtErrorArcsec": 4.373,
      "pathfinderDeltaTSeconds": 73.849,
      "horizonsNominalTimeType": "UT",
      "horizonsNominalTimeValue": "2024-Jan-01 12:00:00.000",
      "horizonsMatchedTimeType": "TT",
      "horizonsMatchedTimeValue": "2024-Jan-01 12:01:13.849",
      "toleranceArcsec": 60,
      "passed": true
    },
    {
      "caseId": "mercury-2050-01-01t00-00-00z",
      "body": "Mercury",
      "utc": "2050-01-01T00:00:00Z",
      "pathfinderLongitudeDeg": 270.0597408,
      "jplNominalUtcLongitudeDeg": 270.059488,
      "jplMatchedTtLongitudeDeg": 270.0592245,
      "nominalUtcErrorArcsec": 0.91,
      "matchedTtErrorArcsec": 1.859,
      "pathfinderDeltaTSeconds": 92.968,
      "horizonsNominalTimeType": "UT",
      "horizonsNominalTimeValue": "2050-Jan-01 00:00:00.000",
      "horizonsMatchedTimeType": "TT",
      "horizonsMatchedTimeValue": "2050-Jan-01 00:01:32.968",
      "toleranceArcsec": 60,
      "passed": true
    },
    {
      "caseId": "venus-1950-01-01t00-00-00z",
      "body": "Venus",
      "utc": "1950-01-01T00:00:00Z",
      "pathfinderLongitudeDeg": 316.9792598,
      "jplNominalUtcLongitudeDeg": 316.9794775,
      "jplMatchedTtLongitudeDeg": 316.9794779,
      "nominalUtcErrorArcsec": 0.784,
      "matchedTtErrorArcsec": 0.785,
      "pathfinderDeltaTSeconds": 29.054,
      "horizonsNominalTimeType": "UT",
      "horizonsNominalTimeValue": "1950-Jan-01 00:00:00.000",
      "horizonsMatchedTimeType": "TT",
      "horizonsMatchedTimeValue": "1950-Jan-01 00:00:29.053",
      "toleranceArcsec": 60,
      "passed": true
    },
    {
      "caseId": "venus-2000-01-01t12-00-00z",
      "body": "Venus",
      "utc": "2000-01-01T12:00:00Z",